smartctl 7.3 2022-02-28 r5338 [x86_64-linux-6.8.0] (local build)
=== START OF INFORMATION SECTION ===
Model Number:                       Example NVMe SSD 4TB
Serial Number:                      SN-REDACTED-1356
Firmware Version:                   1.2.3
PCI Vendor/Subsystem ID:            0x1e4b
IEEE OUI Identifier:                0x001122
Total NVM Capacity:                 4,000,787,030,016 [4.00 TB]
NVMe Version:                       1.4
Number of Namespaces:               1
Namespace 1 Size/Capacity:          4,000,787,030,016 [4.00 TB]
Namespace 1 Formatted LBA Size:     512 bytes
Namespace 1 IEEE EUI-64:            0011223344556677
Local Time is:                      Mon Aug 31 08:00:01 2026 CST
SMART overall-health self-assessment test result: PASSED
SMART/Health Information (NVMe Log 0x02)
Critical Warning:                   0x00
Temperature:                        38 Celsius
Available Spare:                    100%
Available Spare Threshold:          10%
Percentage Used:                    1%
Data Units Read:                    1,234,567 [632 GB]
Data Units Written:                 9,876,543 [5.05 TB]
Host Read Commands:                 12,345,678
Host Write Commands:                87,654,321
Controller Busy Time:               123
Power Cycles:                       42
Power On Hours:                     1,234
Unsafe Shutdowns:                   2
Media and Data Integrity Errors:    0
Error Information Log Entries:      0
Warning  Comp. Temperature Time:    0
Critical Comp. Temperature Time:     0
Temperature Sensor 1:               38 Celsius
Temperature Sensor 2:               40 Celsius
Thermal Temp. 1 Transition Count:   7
Thermal Temp. 1 Total Time:         8
Error Information (NVMe Log 0x01, 16 of 256 entries)
No Errors Logged
